2893460,19870101,article,mesh,"Animals,DNA,Ethane,Hydrocarbons, Chlorinated,Kidney,Lung,Mice,Microsomes, Liver,Proteins,RNA, Ribosomal,Rats","analogs &amp; derivatives,drug effects,enzymology,pharmacokinetics","D008168 Q000187 NN,D004247 Q000187 NY,D007668 Q000187 NN,D006843 Q000493 NY,D004980 Q000031 NY,D008862 Q000187 NY,D008862 Q000201 NN,D012335 Q000187 NY,D004980 Q000493 NN","6,324,659,144,135,670",NULL,"The covalent binding of 1,1,2,2-tetrachloroethane to macromolecules of rat and mouse organs.","The in vivo interaction of the hepatocarcinogen 1,1,2,2-tetrachloroethane (1,1,2,2-TTCE) with DNA, RNA, and proteins of male Wistar rats and BALB/c mice was measured 22 hr after i.p. injection. Covalent binding index (CBI) to liver DNA was about 500 and was comparable to those of carcinogens classified as moderate initiators. It was higher than those of other chloroethanes, even than that of 1,2-dichloroethane (1,2-DCE), a symmetrically substituted haloethane whose genotoxicity has been widely demonstrated.","Teratogenesis, carcinogenesis, and mutagenesis","A Colacci, S Grilli, G Lattanzi, G Prodi, M Paola Turina, G Cantelli Forti, M Mazzullo"," Centro Interuniversitario per la Ricerca sul Cancro, Università degli Studi di Bologna, Italy.",1987 Jan;7(5):465-74,10.1002/tcm.1770070504
2468781,19890101,article,mesh,"Animals,Biotransformation,DNA,Ethane,Hydrocarbons, Chlorinated,Male,Mice,Mice, Inbred BALB C,Mutagens,RNA,Rats,Rats, Inbred Strains,Structure-Activity Relationship","analogs &amp; derivatives,metabolism,toxicity","D006843 Q000378 NY,D004980 Q000633 NN,D004980 Q000031 NY,D006843 Q000633 NN,D004247 Q000378 NY,D004980 Q000378 NN,D012313 Q000378 NY","6,324,119,635,292,340,000,000,000,000",NULL,"Covalent binding of 1,1,1,2-tetrachloroethane to nucleic acids as evidence of genotoxic activity.","Twenty-two hours after ip administration to male Wistar rats and BALB/c mice, 1,1,1,2-tetrachloroethane (1,1,1,2-TTCE) is bound covalently to DNA, RNA, and proteins of liver, lung, kidney, and stomach. The in vivo reactivity leads to binding values to DNA generally higher in mouse organs than in rat organs. The covalent binding index (CBI) values (82 in mouse liver DNA and 40 in rat liver DNA) classify 1,1,1,2-TTCE as a weak to moderate initiator. Both microsomal and cytosolic enzymatic systems from rat and",Journal of toxicology and environmental health,"A Colacci, S Bartoli, B Bonora, C Buttazzi, G Lattanzi, M Mazzullo, A Niero, M P Turina, S Grilli"," Istituto di Cancerologia, Università di Bologna, Italy.",1989 Jan;26(4):485-95,10.1080/15287398909531271
8625443,19960201,article,mesh,"3T3 Cells,Animals,Carcinogens,Cell Transformation, Neoplastic,Dose-Response Relationship, Drug,Ethane,Ethylene Dibromide,Hydrocarbons, Chlorinated,Methylnitronitrosoguanidine,Mice,Tetradecanoylphorbol Acetate","analogs &amp; derivatives,chemically induced,drug effects,pathology,toxicity","D016475 Q000473 NN,D004980 Q000633 NN,D004980 Q000031 NY,D006843 Q000633 NY,D002273 Q000633 NY,D002471 Q000139 NY,D016475 Q000187 NY,D015946 Q000633 NY,D002471 Q000473 NN","479,263,246,591,783,000,000,000,000,000,000,000",NULL,"Enhancement of BALB/c 3T3 cells transformation by 1,2-dibromoethane promoting effect.","Two of the most representative halogenated aliphatic hydrocarbons, 1,2-dibromoethane and 1,1,2,2-tetrachloroethane, were tested in the two-stage cell transformation model for analysing the promoting ability. Both of these compounds had previously been found to exert genotoxic effects, probably acting as moderate initiators. BALB/c 3T3 cells were initiated with subtransforming doses of N-methyl-N-nitro-N-nitrosoguanidine or 3-methylcholanthrene and then exposed to a chronic treatment with different non-trans",Carcinogenesis,"A Colacci, M Vaccari, P Perocco, C Da Vià, P Silingardi, E Manzini, W Horn, S Grilli"," Istituto Nazionale per la Ricerca sul Cancro (IST)-Genova, Biotechnology Satellite Unit Bologna, Italy.",1996 Feb;17(2):225-31,10.1093/carcin/17.2.225
1881351,19910501,article,mesh,"Animals,Arabinose,Biotransformation,Carcinogenicity Tests,Drug Resistance, Microbial,Hydrocarbons, Halogenated,Mutagenicity Tests,Neoplasms, Experimental,Predictive Value of Tests,Rats,Salmonella typhimurium","chemically induced,drug effects,genetics,pharmacology","D001089 Q000494 NN,D009374 Q000139 NN,D012486 Q000235 NN,D012486 Q000187 NY,D006846 Q000494 NY","4,391,955,460,291",NULL,An association between mutagenicity of the Ara test of Salmonella typhimurium and carcinogenicity in rodents for 16 halogenated aliphatic hydrocarbons.,"Sixteen halogenated aliphatic hydrocarbons were assayed for genotoxicity using the Ara mutagenicity assay with Salmonella typhimurium. Seven substances (1,2-dibromo-3-chloropropane, 1,2-dibromoethane, 1,2-dichloroethane, vinyl bromide, hexachloro-1,3-butadiene, iodoform and vinilydene chloride) were mutagenic at non-lethal doses. Comparatively, nine compounds (chloroform, carbon tetrachloride, 1,1,1-trichloroethane, 1,1,2-trichloroethane, tetrachloroethylene, trichloroethylene, 1,1,1,2-tetrachloroethane, 1,",Mutagenesis,"T Roldán-Arjona, M D García-Pedrajas, F L Luque-Romero, C Hera, C Pueyo"," Departamento de Genética, Facultad de Ciencias, Universidad de Córdoba, Spain.",1991 May;6(3):199-205,10.1093/mutage/6.3.199
2792091,19890101,article,mesh,"Animals,Carcinogens,DNA Repair,In Vitro Techniques,Interphase,Liver,Mutagens,Rats,Rats, Inbred F344","cytology,drug effects","D008099 Q000187 NY,D007399 Q000187 NY,D004260 Q000187 NY,D008099 Q000166 NN",NULL,NULL,Measurement of unscheduled DNA synthesis and S-phase synthesis in rodent hepatocytes following in vivo treatment: testing of 24 compounds.,"The in vivo-in vitro hepatocyte DNA repair assay has been shown to be useful for studying genotoxic hepatocarcinogens. In addition, measurement of S-phase synthesis (SPS) provides an indirect indicator of hepatocellular proliferation, which may be an important mechanism in rodent carcinogenesis. This assay was used to examine 24 chemicals for their ability to induce unscheduled DNA synthesis (UDS) or SPS in Fischer-344 rats or B6C3F1 mice following in vivo treatment. Hepatocytes were isolated by liver perfu",Environmental and molecular mutagenesis,"J C Mirsalis, C K Tyson, K L Steinmetz, E K Loh, C M Hamilton, J P Bakke, J W Spalding"," Cellular and Genetic Toxicology Department, SRI International, Menlo Park, California 94025.",1989 Jan;14(3):155-64,10.1002/em.2850140305
15979392,20050704,article,xref,"Animals,Carcinogens,Chromosome Aberrations,Female,Humans,Lymphoma,Male,Mice,Micronucleus Tests,Mutagenicity Tests,Predictive Value of Tests,Rats,Sensitivity and Specificity","chemically induced,methods,toxicity","D009152 Q000379 NY,D002273 Q000633 NN,D008223 Q000139 NN",6838,129345761,"Evaluation of the ability of a battery of three in vitro genotoxicity tests to discriminate rodent carcinogens and non-carcinogens I. Sensitivity, specificity and relative predictivity.","The performance of a battery of three of the most commonly used in vitro genotoxicity tests--Ames+mouse lymphoma assay (MLA)+in vitro micronucleus (MN) or chromosomal aberrations (CA) test--has been evaluated for its ability to discriminate rodent carcinogens and non-carcinogens, from a large database of over 700 chemicals compiled from the CPDB (""Gold""), NTP, IARC and other publications. We re-evaluated many (113 MLA and 30 CA) previously published genotoxicity results in order to categorise the performanc",Mutation research,"David Kirkland, Marilyn Aardema, Leigh Henderson, Lutz Müller"," Covance Laboratories Limited, Otley Road, Harrogate HG3 1PY, UK. david.kirkland@covance.com",2005 Jul;584(?):1-256,10.1016/j.mrgentox.2005.02.004
