16544946,20060301,article,"xref,mesh","Aldehydes,Animals,Cattle,Chromatography, High Pressure Liquid,DNA,DNA Adducts,Indicators and Reagents,Magnetic Resonance Spectroscopy,Reference Standards,Salmonella typhimurium,Spectrometry, Mass, Electrospray Ionization,Spectrophotometry, Ultraviolet","analysis,chemistry,drug effects,metabolism,toxicity","D004247 Q000187 NN,D000447 Q000633 NN,D018736 Q000032 NN,D012486 Q000378 NN,D012486 Q000187 NN,D000447 Q000032 NY,D004247 Q000737 NN","8029,75389,102313,124886,5287477,5323604,44135672","127350601,128270327,129192846,129758065,129813428","Detection of DNA adducts derived from the reactive metabolite of furan, cis-2-butene-1,4-dial.","Furan is a toxic and carcinogenic compound used in industry and commonly found in the environment. The mechanism of furan's carcinogenesis is not well-understood and may involve both genotoxic and nongenotoxic pathways. Furan undergoes oxidation by cytochrome P450 to cis-2-butene-1,4-dial, which is thought to mediate furan's toxic effects. Consistently, cis-2-butene-1,4-dial readily reacts with glutathione, amino acids, and nucleosides. To determine the importance of DNA alkylation in furan-induced carcinog",Chemical research in toxicology,"Michael C Byrns, Choua C Vu, Jonathan W Neidigh, José-Luis Abad, Roger A Jones, Lisa A Peterson"," Division of Environmental Health and Cancer Center, University of Minnesota, Minneapolis, Minnesota 55455, USA.",2006 Mar;19(3):414-20,10.1021/tx050302k
10898583,20000701,article,mesh,"Aldehydes,Dose-Response Relationship, Drug,Furans,Glutathione,Mutagenicity Tests,Mutagens,Mutation,Salmonella typhimurium","drug effects,genetics,metabolism,methods,pharmacology,toxicity","D005978 Q000494 NN,D012486 Q000235 NN,D009152 Q000379 NN,D009154 Q000187 NN,D012486 Q000187 NN,D005663 Q000378 NY,D009153 Q000633 NY,D000447 Q000633 NY","8029,124886,5287477,5323604",NULL,"A reactive metabolite of furan, cis-2-butene-1,4-dial, is mutagenic in the Ames assay.","Furan is classified as a nongenotoxic hepatocarcinogen. It is thought to be activated to a toxic metabolite, cis-2-butene-1,4-dial, which is acutely toxic to liver cells. The resulting cytotoxicity is followed by compensatory cell proliferation, increasing the likelihood of tumor production. We examined the genotoxic activity of cis-2-butene-1,4-dial in several strains of Salmonella typhimurium commonly used in the Ames assay. This reactive compound tested positive in TA104, a strain that is sensitive to al",Chemical research in toxicology,"L A Peterson, K C Naruko, D P Predecki"," Division of Environmental and Occupational Health and Cancer Center, University of Minnesota, Minneapolis 55455, USA.",2000 Jul;13(7):531-4,10.1021/tx000065f
18804178,20081208,article,"xref,mesh","Aldehydes,Animals,Cell Line, Tumor,DNA,DNA Breaks,DNA Damage,Furans,Leukemia L5178,Mice,Mutagenicity Tests,Mutagens,Thymidine Kinase","drug effects,genetics,metabolism,toxicity","D004247 Q000187 NN,D005663 Q000633 NY,D004247 Q000378 NN,D007940 Q000378 NN,D013937 Q000378 NN,D007940 Q000235 NN,D013937 Q000235 NN,D009153 Q000633 NY,D000447 Q000633 NY","1134,3485,4156,8029,75389,284212,5287477,5323604,44135672","127839507,128204655,128270327,128569758,129303766,129813428","Tests for genotoxicity and mutagenicity of furan and its metabolite cis-2-butene-1,4-dial in L5178Y tk+/- mouse lymphoma cells.","Furan is found in various food items and is cytotoxic and carcinogenic in the liver of rats and mice. Metabolism of furan includes the formation of an unsaturated dialdehyde, cis-2-butene-1,4-dial (BDA). In view of the multifunctional electrophilic reactivity of BDA, adduct formation with protein and DNA may explain some of the toxic effects. Short-term tests for genotoxicity of furan in mammalian cells are inconclusive, little is known for BDA. We investigated BDA generated by hydrolysis of 2,5-diacetoxy-2",Mutation research,"Marco Kellert, Andreas Brink, Ingrid Richter, Josef Schlatter, Werner K Lutz"," Department of Toxicology, University of Würzburg, Versbacher Strasse 9, 97078 Würzburg, Germany.",2008 Dec;657(2):127-32,10.1016/j.mrgentox.2008.08.014
22240984,20120401,article,xref,"Animals,Electrophoresis, Gel, Two-Dimensional,Energy Metabolism,Furans,Genomics,Male,Mitochondria, Liver,Oxidation-Reduction,Proteins,Rats,Rats, Inbred F344,Spectrometry, Mass, Electrospray Ionization,Tandem Mass Spectrometry","drug effects,isolation &amp; purification,metabolism,toxicity","D008930 Q000187 NY,D005663 Q000633 NY,D008930 Q000378 NN,D004734 Q000187 NY,D011506 Q000378 NY,D005663 Q000378 NN,D011506 Q000302 NN","5793,5957,8029,75389,5287477","53787684,56459352,128270327,129621433,129813428,129915080",Identification and pathway mapping of furan target proteins reveal mitochondrial energy production and redox regulation as critical targets of furan toxicity.,"Furan, a heat-generated food contaminant, is hepatotoxic and carcinogenic in rodents. Furan is oxidized by cytochrome P450 2E1 to cis-2-butene-1,4-dial, a chemically reactive α,β-unsaturated dialdehyde, which has been identified as the key toxic metabolite of furan based on its ability to interact with tissue nucleophiles. In addition to genotoxicity, sustained cytotoxicity mediated through covalent binding of cis-2-butene-1,4-dial to critical target proteins is thought to play a key role in furan carcinoge",Toxicological sciences : an official journal of the Society of Toxicology,"Sabrina Moro, J Kevin Chipman, Philipp Antczak, Nil Turan, Wolfgang Dekant, Francesco Falciani, Angela Mally"," Department of Toxicology, University of Würzburg, 97078 Würzburg, Germany.",2012 Apr;126(2):336-52,10.1093/toxsci/kfs005
26364877,20151201,article,mesh,"Aldehydes,Animals,DNA,DNA Adducts,DNA Damage,Furans,Liver,Male,Molecular Structure,Rats,Rats, Inbred F344,Toxicokinetics","chemistry,drug effects,metabolism,toxicity","D004247 Q000187 NY,D000447 Q000737 NN,D005663 Q000633 NY,D004247 Q000378 NN,D018736 Q000187 NY,D008099 Q000378 NY,D000447 Q000633 NY,D005663 Q000737 NN","5287477,5323604,44135672",NULL,Evaluation of serum and liver toxicokinetics for furan and liver DNA adduct formation in male Fischer 344 rats.,"Furan is a food processing contaminant found in many common cooked foods that induces liver toxicity and liver cancer in animal models treated with sufficient doses. The metabolism of furan occurs primarily in the liver where CYP 2E1 produces a highly reactive bis-electrophile, cis-2-butene-1,4-dial (BDA). BDA reacts with nucleophilic groups in amino acids and DNA in vitro to form covalent adducts. Evidence for BDA-nucleoside adduct formation in vivo is limited but important for assessing the carcinogenic h",Food and chemical toxicology : an international journal published for the British Industrial Biological Research Association,"M I Churchwell, R C Scheri, L S Von Tungeln, G Gamboa da Costa, F A Beland, D R Doerge"," Division of Biochemical Toxicology, National Center for Toxicological Research, U.S. Food and Drug Administration, Jefferson, AR 72079, USA. Division of Biochemical Toxicology, National Center for Toxicological Research, U.S. Food and Drug Administration, Jefferson, AR 72079, USA. Division of Biochemical Toxicology, National Center for Toxicological Research, U.S. Food and Drug Administration, Jefferson, AR 72079, USA. Division of Biochemical Toxicology, National Center for Toxicological Research, U.S. Foo",2015 Dec;86(?):1-8,10.1016/j.fct.2015.08.029
22115743,20120301,article,"xref,mesh","Animals,Comet Assay,DNA,DNA Damage,Furans,Liver,Propylene Glycols,Turkeys","drug effects,embryology,metabolism,pharmacology","D004247 Q000187 NY,D008099 Q000187 NY,D011409 Q000494 NY,D005663 Q000494 NY,D008099 Q000378 NN,D008099 Q000196 NN","8029,8252,10442,75389,44135672","128270327,129060975,129813428,129828206","Furan induction of DNA cross-linking and strand breaks in turkey fetal liver in comparison to 1,3-propanediol.","Furan, a food contaminant formed by heating, is hepatocarcinogenic to rats and mice. Conflicting genotoxicity data exist on furan and its metabolite, cis-2-butene-1,4-dial and there are few data for the target organ, the liver. We assessed the abilities of furan and, as a positive control, 1,3-propanediol (PDO), to cause DNA damage in the livers of turkey fetuses in ovo using the alkaline comet assay. Single injections of furan (2-20 μmoles) into turkey eggs, at 23 days of incubation, when the liver is well",Food and chemical toxicology : an international journal published for the British Industrial Biological Research Association,"Alan M Jeffrey, Klaus D Brunnemann, Jian-Dong Duan, Josef Schlatter, Gary M Williams"," Department of Pathology, New York Medical College, Valhalla, NY 10595, United States.",2012 Mar;50(?):675-8,10.1016/j.fct.2011.11.011
17145691,20060101,review,xref,"Animals,Biotransformation,Carcinogens,Chemical and Drug Induced Liver Injury,Environmental Pollutants,Furans,Humans","metabolism,physiopathology,toxicity","D005663 Q000633 NY,D004785 Q000378 NY,D056486 Q000503 NN,D002273 Q000633 NY,D004785 Q000633 NY,D002273 Q000378 NY,D005663 Q000378 NY","8029,75389","128270327,129813428",Electrophilic intermediates produced by bioactivation of furan.,"The industrial and environmental chemical, furan, is a liver toxicant and carcinogen in laboratory animals. It has been classified as a possible human carcinogen. The mechanism of tumor induction is unknown. However, toxicity is initiated by cytochrome P450 catalyzed oxidation of furan to an alpha,beta-unsaturated dialdehyde, cis-2-butene-1,4-dial. This metabolite reacts readily with protein and DNA nucleophiles and is a bacterial mutagen in Ames assay strain TA104. Metabolism studies indicate that this rea",Drug metabolism reviews,Lisa A Peterson," Division of Environmental Health Sciences and the Cancer Center, University of Minnesota, Minneapolis, MN 55455, USA. peter431@umn.edu",2006 Jan;38(4):615-26,10.1080/03602530600959417
25344163,20140801,article,mesh,"Alanine Transaminase,Animals,Carcinogens,DNA Damage,Disease Models, Animal,Female,Furans,Liver,Mice,Mice, Inbred Strains,Mice, Transgenic,Mitosis,Mutagenicity Tests,Mutagens,Mutation,Transgenes","drug effects,metabolism,pathology,toxicity","D008099 Q000473 NN,D002273 Q000633 NN,D005663 Q000633 NY,D008938 Q000187 NN,D000410 Q000378 NN,D004249 Q000187 NN,D009153 Q000633 NY,D008099 Q000187 NN",8029,NULL,Mutagenicity of furan in female Big Blue B6C3F1 mice.,"Furan is an abundant food and environmental contaminant that is a potent liver carcinogen in rodent models. To determine if furan is genotoxic in vivo, female B6C3F1 Big Blue transgenic mice were treated with 15 mg/kg bw furan by gavage 5 days a week for 6 weeks, or once weekly for 3 weeks. Liver cII transgene mutation-frequency and mutation spectra were determined. Furan did not increase the mutation frequency under either treatment condition. In the 6-week treatment regimen, there was a change in the cII ",Mutation research. Genetic toxicology and environmental mutagenesis,"Ashley N Terrell, Mailee Huynh, Alex E Grill, Ramesh C Kovi, M Gerard O'Sullivan, Joseph B Guttenplan, Yen-Yi Ho, Lisa A Peterson"," Division of Environmental Health Sciences and Masonic Cancer Center, University of Minnesota, Minneapolis, MN 55455, United States. Electronic address: terre062@umn.edu. Division of Environmental Health Sciences and Masonic Cancer Center, University of Minnesota, Minneapolis, MN 55455, United States. Electronic address: huynh082@umn.edu. Division of Environmental Health Sciences and Masonic Cancer Center, University of Minnesota, Minneapolis, MN 55455, United States. Electronic address: gril0043@umn.edu. M",2014 Aug;770(?):46-54,10.1016/j.mrgentox.2014.04.024
27825936,20161215,article,mesh,"Animals,Carcinogenesis,Carcinogenicity Tests,Carcinogens,Furans,Glutathione,Histones,Liver,Male,Peptides,Rats,Rats, Inbred F344,Trypsin","chemistry,drug effects,metabolism,toxicity","D008099 Q000737 NN,D005978 Q000737 NN,D063646 Q000187 NY,D005663 Q000633 NY,D014357 Q000737 NN,D002273 Q000633 NY,D010455 Q000737 NN,D008099 Q000378 NN,D005663 Q000378 NN,D006657 Q000633 NY",124886,NULL,New insights into the molecular mechanisms of chemical carcinogenesis: In vivo adduction of histone H2B by a reactive metabolite of the chemical carcinogen furan.,"Furan is a rodent hepatocarcinogen ubiquitously found in the environment and heat-processed foods. Furan undergoes cytochrome P450 2E1-catalyzed bioactivation to cis-2-butene-1,4-dial (BDA), which has been shown to form an electrophilic conjugate (GSH-BDA) with glutathione. Both BDA and GSH-BDA yield covalent adducts with lysine residues in proteins. Dose- and time-dependent epigenetic histone alterations have been observed in furan-treated rats. While the covalent modification of histones by chemical carci",Toxicology letters,"João Nunes, Inês L Martins, Catarina Charneira, Igor P Pogribny, Aline de Conti, Frederick A Beland, M Matilde Marques, Cristina C Jacob, Alexandra M M Antunes"," Centro de Química Estrutural, Instituto Superior Técnico, Universidade de Lisboa, Lisboa, Portugal. Centro de Química Estrutural, Instituto Superior Técnico, Universidade de Lisboa, Lisboa, Portugal. Centro de Química Estrutural, Instituto Superior Técnico, Universidade de Lisboa, Lisboa, Portugal. Division of Biochemical Toxicology, National Center for Toxicological Research, Jefferson, AR 72079, USA. Division of Biochemical Toxicology, National Center for Toxicological Research, Jefferson, AR 72079, USA.",2016 Dec;264(?):106-113,10.1016/j.toxlet.2016.10.018
